{"commandId":"report_b6a51da9-faa4-4491-a88b-253b0de23552","intakeDigest":"6747bdda11db3dfa8610510fbde8442c8da0ce69541d88b11fb3e69d03a3a079","intakeFile":"issues/AH-20260913-6747BDDA11DB/intake.json","issueFile":"issues/AH-20260913-6747BDDA11DB/issue.md","issueId":"AH-20260913-6747BDDA11DB","operation":"issue.record","protocolVersion":"1.0","recordedAt":"2026-09-13T14:08:04.345Z","requestDigest":"207d070eedea2a366b79fe5213db03bbfcfbe1ce1872195bd379ecefb4296df0"}
