{"commandId":"report_9a44c2d6-f44e-400e-92d0-e992bc12e3fa","intakeDigest":"7c7b43e926d2255f5e51c5d67046824748093e140d384d3ba29deb818f813f40","intakeFile":"issues/AH-20260916-7C7B43E926D2/intake.json","issueFile":"issues/AH-20260916-7C7B43E926D2/issue.md","issueId":"AH-20260916-7C7B43E926D2","operation":"issue.record","protocolVersion":"1.0","recordedAt":"2026-09-16T13:44:44.831Z","requestDigest":"f6b95c5f44b3eb3d2e1b83264e053b0dcbaf9b77db05d72a38d579786a23dd05"}
