{"commandId":"AH-20260915-report-engine-5be215b9-a2cd-4853-b752-be22de613b15","intakeDigest":"4ec6fd529baa3d9f8d906c4bd8a0ecc8cdff7f629ec6121ada775676f5a274ce","intakeFile":"issues/AH-20260915-4EC6FD529BAA/intake.json","issueFile":"issues/AH-20260915-4EC6FD529BAA/issue.md","issueId":"AH-20260915-4EC6FD529BAA","operation":"issue.record","protocolVersion":"1.0","recordedAt":"2026-09-15T02:25:01.630Z","requestDigest":"93e37580eb1dfccfa40d53cc498452be5f59afbad0afe91cc10d7c3c6919ef3a"}
