{"commandId":"report_439338e1f93d41cda6d9b59d0675689e","intakeDigest":"c27838a16da690d53f32f5473c99505ad13e22064f7cf081a7effb8958dc5b01","intakeFile":"issues/AH-20260914-C27838A16DA6/intake.json","issueFile":"issues/AH-20260914-C27838A16DA6/issue.md","issueId":"AH-20260914-C27838A16DA6","operation":"issue.record","protocolVersion":"1.0","recordedAt":"2026-09-14T13:30:45.208Z","requestDigest":"1a40c92bf817d3dc8902cd0d42e2713f8a8e2e2e113b457576ada81a981392db"}
