{"commandId":"report_8b26a1f8-d929-4c6a-8de6-9711b6c218a2","intakeDigest":"5323cea6386f37a2a9714dbf48091f4d75fd0821bf99e9186eb125bc0a597a1d","intakeFile":"issues/AH-20260915-5323CEA6386F/intake.json","issueFile":"issues/AH-20260915-5323CEA6386F/issue.md","issueId":"AH-20260915-5323CEA6386F","operation":"issue.record","protocolVersion":"1.0","recordedAt":"2026-09-15T14:10:20.700Z","requestDigest":"762f5352c5a1a3f44409e3abd0ee10cd9b53635f553ac11207a8f4acd5019214"}
