{"commandId":"report_AH_20260914_01a09f7e-0568-7111-8715-a8181670abf5","intakeDigest":"b5475e479753fd76998491e6503d7369fb4f81e8a1726eaf71dd2142f13ac761","intakeFile":"issues/AH-20260914-B5475E479753/intake.json","issueFile":"issues/AH-20260914-B5475E479753/issue.md","issueId":"AH-20260914-B5475E479753","operation":"issue.record","protocolVersion":"1.0","recordedAt":"2026-09-14T10:58:49.994Z","requestDigest":"17d489ea3bf1a433e5853753adb2b85779b363ed10c59dbb2476e21e29a4f8f2"}
