{"commandId":"report_AH_20260914_engine_8a7e09a2-71e6-4d64-bd3d-6e386d7248b4","intakeDigest":"f16b3ebb0898e770062fa6d217179a805c63920d199a72318845b7293344595a","intakeFile":"issues/AH-20260914-F16B3EBB0898/intake.json","issueFile":"issues/AH-20260914-F16B3EBB0898/issue.md","issueId":"AH-20260914-F16B3EBB0898","operation":"issue.record","protocolVersion":"1.0","recordedAt":"2026-09-14T14:30:57.690Z","requestDigest":"78cc4e9c379c02f3ad62c818d73033fe0739cf8aab902d303174d55965b526bd"}
