{"commandId":"report_b0321eef-7411-4c49-82b2-96b7badc6efe","intakeDigest":"ab121ad18464e021d0ebd370b0f00536ec202dcae0b8003dd226484cf5a8207f","intakeFile":"issues/AH-20260920-AB121AD18464/intake.json","issueFile":"issues/AH-20260920-AB121AD18464/issue.md","issueId":"AH-20260920-AB121AD18464","operation":"issue.record","protocolVersion":"1.0","recordedAt":"2026-09-20T12:05:21.618Z","requestDigest":"947bd36ce4a9e052f353b59904f02feb3d6a6f6b3ab481e12f0324302cb5276b"}
