{"commandId":"report_46d8dcda-73f4-4203-ac96-bdddba0de13e","intakeDigest":"7007e9bfafd446ffe882b9cae9b8ec014b4a5aa163c483301686b5ad30535f57","intakeFile":"issues/AH-20260915-7007E9BFAFD4/intake.json","issueFile":"issues/AH-20260915-7007E9BFAFD4/issue.md","issueId":"AH-20260915-7007E9BFAFD4","operation":"issue.record","protocolVersion":"1.0","recordedAt":"2026-09-15T10:05:13.227Z","requestDigest":"7a82c5492a8d872032437026f004c4f13ecc52ba508d8cf611a705b1255faea4"}
