{"commandId":"h-report-engine-d1cb7ce5-02d9-43e1-9de3-3b14b1ca9890","intakeDigest":"43658be83791b0553b4cadd026295ab8f015053e5b3996a70d1c856b70ea4949","intakeFile":"issues/AH-20260915-43658BE83791/intake.json","issueFile":"issues/AH-20260915-43658BE83791/issue.md","issueId":"AH-20260915-43658BE83791","operation":"issue.record","protocolVersion":"1.0","recordedAt":"2026-09-15T11:32:07.896Z","requestDigest":"5b3def4d84d3abba8bb83aa82911304584e47086f440893b1686fe9ae19783a1"}
