{"commandId":"report_engine_data_root_20260913","intakeDigest":"ab2dbedce37b90e58da771eb5e3a93224dec0923bf4c397caf30ba2f434141a1","intakeFile":"issues/AH-20260913-AB2DBEDCE37B/intake.json","issueFile":"issues/AH-20260913-AB2DBEDCE37B/issue.md","issueId":"AH-20260913-AB2DBEDCE37B","operation":"issue.record","protocolVersion":"1.0","recordedAt":"2026-09-13T12:26:08.697Z","requestDigest":"96f6f37d4878773c5c3ed1e35c99119b39b7fd37ceb3e8cf33d92126c979e46d"}
