{"commandId":"report_7577152b-5d77-49e1-9129-94b6ea326235","intakeDigest":"d5f65d00699bafe86b7502479450d98c65295dd6addf93ae323ae359c9beba33","intakeFile":"issues/AH-20260920-D5F65D00699B/intake.json","issueFile":"issues/AH-20260920-D5F65D00699B/issue.md","issueId":"AH-20260920-D5F65D00699B","operation":"issue.record","protocolVersion":"1.0","recordedAt":"2026-09-20T14:32:24.690Z","requestDigest":"d3ec3317b71d8d7dbdd24ecdd4364c09c0270d27639e1e88ecbc38e728a20dc4"}
