{"commandId":"report_2e26c30a-f323-4aba-90f4-196919dc6978","intakeDigest":"3218a00aaefb196b1c54242e18cf37f9750099726ab5a83533b75efa6c3d462a","intakeFile":"issues/AH-20260915-3218A00AAEFB/intake.json","issueFile":"issues/AH-20260915-3218A00AAEFB/issue.md","issueId":"AH-20260915-3218A00AAEFB","operation":"issue.record","protocolVersion":"1.0","recordedAt":"2026-09-15T07:41:35.186Z","requestDigest":"d5641cb8ba2216675bd9a5b17c70ade292dfb3207189a2f29da9e52bffb3829b"}
