{"commandId":"report_806afed4-060b-4d46-8334-0b82803b9939","intakeDigest":"a2ba04039e7c64dd7398290bcccbd8ad1c6f0e0109e271932b046353174c4a12","intakeFile":"issues/AH-20260916-A2BA04039E7C/intake.json","issueFile":"issues/AH-20260916-A2BA04039E7C/issue.md","issueId":"AH-20260916-A2BA04039E7C","operation":"issue.record","protocolVersion":"1.0","recordedAt":"2026-09-16T13:40:15.798Z","requestDigest":"eb303522692116c2e6c60ab9c285a2fd7d119bcf25484e6094bf6da9950443b5"}
