{"commandId":"report_AH_20260915_5323CEA6386F_supplement_20260915T142458Z","intakeDigest":"570c48837b4edbf14b047c2c64d5c6b7e34cca43c4d6f2b3a3b710a776733759","intakeFile":"issues/AH-20260915-570C48837B4E/intake.json","issueFile":"issues/AH-20260915-570C48837B4E/issue.md","issueId":"AH-20260915-570C48837B4E","operation":"issue.record","protocolVersion":"1.0","recordedAt":"2026-09-15T14:25:46.509Z","requestDigest":"fa1602284bb768cf297cc10830eefa5940a1a9ef4cee4e64c822c7d8c296beab"}
