{"commandId":"9051ff87-f694-4ca5-a032-fb6cf68eabe1","intakeDigest":"da8ca73021dbd2d0bda2e4f65c04e63bf53f9a15fbea44933b55fd7090b70ddd","intakeFile":"issues/AH-20260913-DA8CA73021DB/intake.json","issueFile":"issues/AH-20260913-DA8CA73021DB/issue.md","issueId":"AH-20260913-DA8CA73021DB","operation":"issue.record","protocolVersion":"1.0","recordedAt":"2026-09-13T13:06:44.612Z","requestDigest":"a494816c33667d9a50f01b7577e2d3dcdf3d11f236da0914d33cc67729d27911"}
