{"commandId":"report_5728f3ca-98ae-4121-8113-1319ce122564","intakeDigest":"a79db71dea402fb8c96c5209986ae92cfcaba55ee0a83cc5efd6d13bf484b267","intakeFile":"issues/AH-20260920-A79DB71DEA40/intake.json","issueFile":"issues/AH-20260920-A79DB71DEA40/issue.md","issueId":"AH-20260920-A79DB71DEA40","operation":"issue.record","protocolVersion":"1.0","recordedAt":"2026-09-20T14:32:58.682Z","requestDigest":"bc01e0de3d7eea0634e882840bf1f687de3800d1133075e95248290ff9558d4f"}
