{"commandId":"g2-host-hook-gap-20260923","intakeDigest":"19eaab8c220e896a0fa129d217c8f2c6ee09087a48028b8b32319be7ba6f9a4c","intakeFile":"issues/AH-20260923-19EAAB8C220E/intake.json","issueFile":"issues/AH-20260923-19EAAB8C220E/issue.md","issueId":"AH-20260923-19EAAB8C220E","operation":"issue.record","protocolVersion":"1.0","recordedAt":"2026-09-23T15:04:34.908Z","requestDigest":"4704fbcf0d1f24704085ae2bddf05d537180dcd2131e9bfd59f79091fa89228a"}
