{"commandId":"report_AH_20260915_446bd913-fb56-4c63-a44f-cc02f2270cd4","intakeDigest":"f9c3fc2090f4bc6a1f1bfffc90c96d953831b27262f58a67e5b6199a5c88266c","intakeFile":"issues/AH-20260915-F9C3FC2090F4/intake.json","issueFile":"issues/AH-20260915-F9C3FC2090F4/issue.md","issueId":"AH-20260915-F9C3FC2090F4","operation":"issue.record","protocolVersion":"1.0","recordedAt":"2026-09-15T01:16:01.548Z","requestDigest":"eae49cb931a3ec90b4e51b8927054caa6fc76f12229296025cb28b28fff997fc"}
