{"commandId":"report_56f31772-b043-4c7a-84d5-83a1c1a92548","intakeDigest":"e31036d1068a41632e3b65af698a224425afd76ecd7bcdcce6dae017bd24d9e4","intakeFile":"issues/AH-20260914-E31036D1068A/intake.json","issueFile":"issues/AH-20260914-E31036D1068A/issue.md","issueId":"AH-20260914-E31036D1068A","operation":"issue.record","protocolVersion":"1.0","recordedAt":"2026-09-14T12:09:08.618Z","requestDigest":"0eaa18ff81a918a956dbfc592e1f33fe82605754b5077cdbb1602ba5cd08483d"}
