{"commandId":"report_21722ea2-63c3-4cdc-ade5-e2fbc596d2d5","intakeDigest":"68116284f352852f823f761ff567a5e013f4dc55085be7ecc1eb7f514ce9141c","intakeFile":"issues/AH-20260915-68116284F352/intake.json","issueFile":"issues/AH-20260915-68116284F352/issue.md","issueId":"AH-20260915-68116284F352","operation":"issue.record","protocolVersion":"1.0","recordedAt":"2026-09-15T03:11:12.856Z","requestDigest":"b62d895f3522803dcd0adb12d5f63b8071aa7f68baa8dafd2e98373fdf93c8ba"}
