{"commandId":"report_AH_20260915_7f22c7bf1e284b2a9c7a7d8ce0a7f6d1","intakeDigest":"8c001f4d266ea2c7b9148aa60435711f8f02ca6267ead8b6cf93b11ccc5dbb94","intakeFile":"issues/AH-20260915-8C001F4D266E/intake.json","issueFile":"issues/AH-20260915-8C001F4D266E/issue.md","issueId":"AH-20260915-8C001F4D266E","operation":"issue.record","protocolVersion":"1.0","recordedAt":"2026-09-15T04:01:08.020Z","requestDigest":"f323d0c22d33a690c3775762d83221453130a5590e70cd541cf4b36436bb4287"}
